{
  "standard": "EIGIIB-E14-A4-1.0",
  "status": "structural-only",
  "upstream_projection_registry": "conformance/confidential-evidence.json",
  "upstream_authorization_registry": "conformance/disclosure-authorization.json",
  "upstream_correlation_registry": "conformance/correlation-control.json",
  "freshness_sources": [],
  "distribution_channels": [],
  "status_histories": [],
  "disclosure_attempts": [],
  "decisions": []
}
